[
  {
    "id": "planning_apply_mustard_hotdog",
    "task_id": "task_apply_mustard_hotdog",
    "requirements": [
      {
        "key": "scene_id",
        "value": "scene_dining_table",
        "reason": "The candidate is scoped to this scene context."
      },
      {
        "key": "object",
        "value": "ycb_006_mustard_bottle",
        "reason": "The YCB mustard bottle is the task theme."
      },
      {
        "key": "condition",
        "value": "initial_closed_ycb_006_mustard_bottle",
        "reason": "Required initial predicate: closed(ycb_006_mustard_bottle)"
      },
      {
        "key": "condition",
        "value": "initial_contains_ycb_006_mustard_bottle_mustard",
        "reason": "Required initial predicate: contains(ycb_006_mustard_bottle, mustard)"
      },
      {
        "key": "condition",
        "value": "initial_on_top_of_ycb_006_mustard_bottle_dining_table",
        "reason": "Required initial predicate: on_top_of(ycb_006_mustard_bottle, dining_table)"
      },
      {
        "key": "condition",
        "value": "initial_near_food_hotdog_dining_table",
        "reason": "Required initial predicate: near(food_hotdog, dining_table)"
      },
      {
        "key": "object",
        "value": "material_mustard",
        "reason": "Task binding resource: material_mustard"
      },
      {
        "key": "object",
        "value": "food_hotdog",
        "reason": "Task binding resource: food_hotdog"
      },
      {
        "key": "capability",
        "value": "rigid_manipulation",
        "reason": "Needed by the proposed task design."
      },
      {
        "key": "capability",
        "value": "articulated_closure",
        "reason": "Needed by the proposed task design."
      },
      {
        "key": "capability",
        "value": "deformable_squeezing",
        "reason": "Needed by the proposed task design."
      },
      {
        "key": "capability",
        "value": "material_flow",
        "reason": "Needed by the proposed task design."
      },
      {
        "key": "role",
        "value": "home_user",
        "reason": "This seed is framed as a household activity."
      },
      {
        "key": "contents",
        "value": "full",
        "reason": "Bottle contents determine whether this activity applies."
      }
    ],
    "procedures": [],
    "collection": {
      "success_criteria": [
        "Mustard reaches the specified food target and the bottle is closed."
      ],
      "setup": [
        "Place a prepared food target and closed filled bottle in the scene."
      ],
      "reset": [
        "Replace food, remove mustard residue, and close the bottle."
      ],
      "quality_checks": [
        "Confirm deposit is on the intended food target."
      ],
      "failure_modes": [
        "Target miss or material spill."
      ],
      "consumables": [
        "Mustard",
        "prepared food",
        "cleaning material"
      ],
      "time_estimates": {
        "setup_minutes": null,
        "execution_minutes": null,
        "reset_minutes": null,
        "review_minutes": null
      }
    }
  },
  {
    "id": "planning_apply_mustard_sandwich",
    "task_id": "task_apply_mustard_sandwich",
    "requirements": [
      {
        "key": "scene_id",
        "value": "scene_home_kitchen",
        "reason": "The candidate is scoped to this scene context."
      },
      {
        "key": "object",
        "value": "ycb_006_mustard_bottle",
        "reason": "The YCB mustard bottle is the task theme."
      },
      {
        "key": "condition",
        "value": "initial_closed_ycb_006_mustard_bottle",
        "reason": "Required initial predicate: closed(ycb_006_mustard_bottle)"
      },
      {
        "key": "condition",
        "value": "initial_contains_ycb_006_mustard_bottle_mustard",
        "reason": "Required initial predicate: contains(ycb_006_mustard_bottle, mustard)"
      },
      {
        "key": "condition",
        "value": "initial_on_top_of_ycb_006_mustard_bottle_kitchen_counter",
        "reason": "Required initial predicate: on_top_of(ycb_006_mustard_bottle, kitchen_counter)"
      },
      {
        "key": "condition",
        "value": "initial_near_food_sandwich_kitchen_counter",
        "reason": "Required initial predicate: near(food_sandwich, kitchen_counter)"
      },
      {
        "key": "object",
        "value": "material_mustard",
        "reason": "Task binding resource: material_mustard"
      },
      {
        "key": "object",
        "value": "food_sandwich",
        "reason": "Task binding resource: food_sandwich"
      },
      {
        "key": "capability",
        "value": "rigid_manipulation",
        "reason": "Needed by the proposed task design."
      },
      {
        "key": "capability",
        "value": "articulated_closure",
        "reason": "Needed by the proposed task design."
      },
      {
        "key": "capability",
        "value": "deformable_squeezing",
        "reason": "Needed by the proposed task design."
      },
      {
        "key": "capability",
        "value": "material_flow",
        "reason": "Needed by the proposed task design."
      },
      {
        "key": "role",
        "value": "home_user",
        "reason": "This seed is framed as a household activity."
      },
      {
        "key": "contents",
        "value": "full",
        "reason": "Bottle contents determine whether this activity applies."
      }
    ],
    "procedures": [],
    "collection": {
      "success_criteria": [
        "Mustard reaches the specified food target and the bottle is closed."
      ],
      "setup": [
        "Place a prepared food target and closed filled bottle in the scene."
      ],
      "reset": [
        "Replace food, remove mustard residue, and close the bottle."
      ],
      "quality_checks": [
        "Confirm deposit is on the intended food target."
      ],
      "failure_modes": [
        "Target miss or material spill."
      ],
      "consumables": [
        "Mustard",
        "prepared food",
        "cleaning material"
      ],
      "time_estimates": {
        "setup_minutes": null,
        "execution_minutes": null,
        "reset_minutes": null,
        "review_minutes": null
      }
    }
  },
  {
    "id": "planning_handover_mustard_to_person",
    "task_id": "task_handover_mustard_to_person",
    "requirements": [
      {
        "key": "scene_id",
        "value": "scene_dining_table",
        "reason": "The candidate is scoped to this scene context."
      },
      {
        "key": "object",
        "value": "ycb_006_mustard_bottle",
        "reason": "The YCB mustard bottle is the task theme."
      },
      {
        "key": "condition",
        "value": "initial_on_top_of_ycb_006_mustard_bottle_dining_table",
        "reason": "Required initial predicate: on_top_of(ycb_006_mustard_bottle, dining_table)"
      },
      {
        "key": "condition",
        "value": "initial_recipient_present",
        "reason": "Required initial predicate: recipient_present"
      },
      {
        "key": "condition",
        "value": "initial_reachable_ycb_006_mustard_bottle",
        "reason": "Required initial predicate: reachable(ycb_006_mustard_bottle)"
      },
      {
        "key": "object",
        "value": "adult_diner",
        "reason": "Task binding resource: adult_diner"
      },
      {
        "key": "capability",
        "value": "rigid_manipulation",
        "reason": "Needed by the proposed task design."
      },
      {
        "key": "capability",
        "value": "human_handover",
        "reason": "Needed by the proposed task design."
      },
      {
        "key": "role",
        "value": "home_user",
        "reason": "This seed is framed as a household activity."
      }
    ],
    "procedures": [],
    "collection": {
      "success_criteria": [
        "Recipient has stable possession before robot release."
      ],
      "setup": [
        "Position a consenting recipient and a closed bottle in the handover zone."
      ],
      "reset": [
        "Return bottle to table and clear the handover zone."
      ],
      "quality_checks": [
        "Review recipient grasp and release timing."
      ],
      "failure_modes": [
        "Early release or unsafe contact."
      ],
      "consumables": [],
      "time_estimates": {
        "setup_minutes": null,
        "execution_minutes": null,
        "reset_minutes": null,
        "review_minutes": null
      }
    }
  },
  {
    "id": "planning_return_mustard_to_refrigerator",
    "task_id": "task_return_mustard_to_refrigerator",
    "requirements": [
      {
        "key": "scene_id",
        "value": "scene_dining_table",
        "reason": "The candidate is scoped to this scene context."
      },
      {
        "key": "object",
        "value": "ycb_006_mustard_bottle",
        "reason": "The YCB mustard bottle is the task theme."
      },
      {
        "key": "condition",
        "value": "initial_on_top_of_ycb_006_mustard_bottle_dining_table",
        "reason": "Required initial predicate: on_top_of(ycb_006_mustard_bottle, dining_table)"
      },
      {
        "key": "condition",
        "value": "initial_closed_ycb_006_mustard_bottle",
        "reason": "Required initial predicate: closed(ycb_006_mustard_bottle)"
      },
      {
        "key": "condition",
        "value": "initial_closed_refrigerator",
        "reason": "Required initial predicate: closed(refrigerator)"
      },
      {
        "key": "condition",
        "value": "initial_reachable_ycb_006_mustard_bottle",
        "reason": "Required initial predicate: reachable(ycb_006_mustard_bottle)"
      },
      {
        "key": "object",
        "value": "scene_refrigerator",
        "reason": "Task binding resource: scene_refrigerator"
      },
      {
        "key": "capability",
        "value": "rigid_manipulation",
        "reason": "Needed by the proposed task design."
      },
      {
        "key": "capability",